,details
19,"{'Location': 'Sardar Patel Marg Diplomatic Enclave, Central Delhi, New Delhi and NCR, India, 110021', 'overall_rating': '8.9', 'Name': 'Taj Palace', 'reviews': [{'Review_Rating': '8.8', 'Review_Heading': 'The Best Hotel group ”', 'Review_Body': 'One of the best Hotel  Chains in India. Wonderful people working behind day & night 24/7.\nDuring my stays at many Taj Group Hotels,I have never had any problems or disappointed. You may pay a bit extra but it’s all worth every penny. So enjoy & let them show you the real hospitality ❤️'}, {'Review_Rating': '10.0', 'Review_Heading': 'Great location ”', 'Review_Body': 'Great location, very clean and excellent service by the Guest Relations staff \nThe super quick check in by Sampurna and DM Karan was too good \nThe check out too was seamless \nIts service like this that will make us return to the Taj Delhi'}, {'Review_Rating': '7.6', 'Review_Heading': 'Exceptional property enjoyed my stay”', 'Review_Body': '\n'}, {'Review_Rating': '7.6', 'Review_Heading': 'Good stay”', 'Review_Body': 'Good: Rooms are spacious, has the old world charm, staff are courteous,Property is large and expansive, has a luxurious feel, breakfast layout and spread was good, taste could have been better\n\nCould have been better: Swimming pool was not clean, the floor was slippery due to bird droppings and water was smelly, Can have some more recreational facilities for children'}, {'Review_Rating': '6.8', 'Review_Heading': 'Good”', 'Review_Body': 'USB mobile charging point not available, BOSE speaker is available but not connected with TV. Breakfast menu very limited.'}, {'Review_Rating': '8.0', 'Review_Heading': 'Good Stay”', 'Review_Body': 'Had an enjoyable stay. '}, {'Review_Rating': '10.0', 'Review_Heading': 'Great ”', 'Review_Body': 'Great '}, {'Review_Rating': '9.6', 'Review_Heading': 'Greatest value for money”', 'Review_Body': 'Try to get a room in 7k to 9k '}, {'Review_Rating': '5.2', 'Review_Heading': 'Taj Palace New Delhi”', 'Review_Body': 'Tiny rooms, Facilities not worth mentioning, Restaurants need an uplift, pricing is exorbitant'}, {'Review_Rating': '6.0', 'Review_Heading': 'Poor hospitality ”', 'Review_Body': 'Front desk staff is not active. It took 20 min to check in formalities. High tea was refused to us as we were late for 10 min due to check in formalities. Poor quality or snacks served as they charged 11,800 for buffet dinner on Christmas Eve. Very disappointing.'}], 'price': '17,500', 'img_link': 'https://q-xx.bstatic.com/xdata/images/hotel/840x460/434138512.jpg?k=3ea8bf61443c059b9256ff7fa53d7f874265b8d934d271824ea235b5ceda2146&o=', 'room_size': '30m²', 'amenities': ['2 single beds', 'Garden view', 'Non-smoking', 'Separate shower/bathtub', 'Free Wi-Fi', 'Bathrobes', 'Bathroom phone', 'Hair dryer', 'Mirror', 'Scale', 'Toiletries', 'Towels', 'DVD/CD player', 'Free Wi-Fi in all rooms!', 'On-demand movies', 'Satellite/cable channels', 'Telephone', 'Video game console', 'Air conditioning', 'Alarm clock', 'Blackout curtains', 'Daily newspaper', 'Slippers', 'Soundproofing', 'Wake-up service', 'Coffee/tea maker', 'Free bottled water', 'Mini bar', 'Refrigerator', 'Daily housekeeping', 'Carpeting', 'Desk', 'Interconnecting room(s) available', 'Laptop workspace', 'Closet', 'Clothes rack', 'Ironing facilities', 'Sewing kit', 'Shoeshine kit', 'Trouser press', 'In-room safe box', 'Smoke detector'], 'city': 'Delhi NCR', 'link': 'https://agoda.com/en-gb/taj-palace/hotel/new-delhi-and-ncr-in.html?finalPriceView=1&isShowMobileAppPrice=false&cid=-999&numberOfBedrooms=&familyMode=false&adults=2&children=0&rooms=1&maxRooms=0&checkIn=2023-03-18&isCalendarCallout=false&childAges=&numberOfGuest=0&missingChildAges=false&travellerType=1&showReviewSubmissionEntry=false&currencyCode=INR&isFreeOccSearch=false&isCityHaveAsq=false&los=1&searchrequestid=b7279941-44b9-4c5f-8bf9-6c553d4e58a8'}"
20,"{'Location': ""Gurgaon - Delhi Expy, Indira Gandhi Int'l Airport, New Delhi and NCR, India, 110037"", 'overall_rating': 'Select your room', 'Name': 'Foxoso Hotel Delhi Airport', 'reviews': [{'Review_Rating': '9.6', 'Review_Heading': 'A really pleasant stay!”', 'Review_Body': ""From hotel facilities to staff to food everything's on point, will definitely recommend.""}, {'Review_Rating': '3.2', 'Review_Heading': 'Avoid”', 'Review_Body': 'Room smelled extremely moldy, so we asked to switch, second room was just as bad. This is explained as there is no ventilation in the bathrooms and no windows to air out. Additionally, very thin walls - you could hear everything, TVs next door and doors banging at all times (with this being an airport hotel the whole night through)\nRude staff'}, {'Review_Rating': '4.0', 'Review_Heading': 'Foxoso Hotel ”', 'Review_Body': 'Convenient location. Facilities not up to standard.  Expected more cleaner rooms and intact facilities in that hotel. Food was ok. Staff seemed to be helpful. '}, {'Review_Rating': '7.6', 'Review_Heading': 'Good for transit stay”', 'Review_Body': 'Near to airport, no issues in service. '}, {'Review_Rating': '2.0', 'Review_Heading': 'Acceptable”', 'Review_Body': 'Pathetic. Please try to maintain hygiene atleast. '}, {'Review_Rating': '3.2', 'Review_Heading': 'Small room without window”', 'Review_Body': 'Small rooms without window and having dump walls. Smell was bad when i asked for change they said we are fully booked.\nI would not recommend this hotel if you are going to take it be sure to take window room.'}, {'Review_Rating': '2.4', 'Review_Heading': 'Disgraceful”', 'Review_Body': 'Rooms leave a lot to be desired. Staff at best are insensitive. I had a booking with the meal plan and yet, the restaurant denied the whole thing and create a scene.  And the front desk confirms the plan! So much for internal co-ordination and communication. Not a recomended place at all'}, {'Review_Rating': '7.6', 'Review_Heading': 'Convenient”', 'Review_Body': 'The overall location of the hotel is very convenient, however, the location in the uber app says that is right in the street but actually you have to walk inside the little alley for a minute maybe? which is not bad but feels unsafe. For India standards the hotel is very clean, good value for money, the breakfast is good. However, the walls are too thin so you can listen to a lot of noise. I really liked how safe the hotel itself, felt. '}, {'Review_Rating': '7.6', 'Review_Heading': 'Early flight night stay”', 'Review_Body': ""We stayed in Foxoso as it is located 10min away from T3 (without traffic). We booked the Suite room which was perfect. Very clean and spacious. What I didn't like is that they charge 500INR for the car transfer to thr airport when you can pre-book Ola or Uber for 175-200INR. ""}, {'Review_Rating': '6.8', 'Review_Heading': 'Buffet breakfast was best and staff is very professional ”', 'Review_Body': 'Hi stayed in this hotel \nAmazing buffet breakfast and staff service however facilities are poor \nShower wasn’t working at all \nNo access of hot and cold water \nVery noisy place '}, {'Review_Rating': '2.4', 'Review_Heading': 'Not worth the money!”', 'Review_Body': ""Location- The street gives eerie vibes, you will have to look for it, not on any main road as appears in the picture.\nOverpriced- No facilities none good enough to pay this amount for, seriously even handwash and tissues were of low quality.\nThe staff is polite and helpful but at the same time I ain't staying there to socialize with staff.\nA waste of money, not recommended at all.""}, {'Review_Rating': '10.0', 'Review_Heading': 'Nice”', 'Review_Body': 'Nice'}, {'Review_Rating': '9.2', 'Review_Heading': 'Perfect for between flights”', 'Review_Body': 'Gratefully I was able to check in early and get a great rest after the long flight. My Uber ride back to the airport  the next morning was less than 300 INR. Staff was very nice, they printed out a document I needed, and the breakfast was Amazing!!'}, {'Review_Rating': '4.0', 'Review_Heading': '2-Star Hotel Self-proclaimed as 4-star”', 'Review_Body': ""The staff were great, and the food at the restaurant was amazing, but the facilities are definitely in dire need of repair. The sheets had small holes in them, the towels were bleached grey, and the rooms are either windowless or have a window facing the main drag (too noisy). \n\nAlso, the water in the shower only got slightly warm. It stayed worm for maybe one minute, then went cold again. This may be good during the summer, but it's wintertime currently and some hot water would have been nice.\n\nAgoda does not give the star rating, it's given by the hotel to Agoda and they simply accept it. This may be a 4-star by Indian standards, but it is a 2- star hotel by international standards.\n\nThe IBIS across the street is only ~$15 more and would be a much better choice, but it's all about what you're looking for.\n\nI forfeit the paid rate for the second night and moved over to the Novotel instead, it was night-and-day. No hot water was the final straw.""}, {'Review_Rating': '2.4', 'Review_Heading': 'Not recommend ”', 'Review_Body': 'Noisy rooms\nPeople were fighting with staff\nDnt let us sleep '}, {'Review_Rating': '8.0', 'Review_Heading': 'Good for one night stay only”', 'Review_Body': 'The staff and the service was all okay but just the room was quite small for the price. The room had no view so to say and the parking garage also seems risky.'}, {'Review_Rating': '10.0', 'Review_Heading': 'Good”', 'Review_Body': 'Terbaik '}, {'Review_Rating': '4.0', 'Review_Heading': 'Wont recommend at all”', 'Review_Body': ""The room wasnt cleaned properly, the washroom too didnt seem clean at all. Housekeeping is very poor. Hot water went out after 5 minutes and in Delhi's winter its just impossible to bathe with lukewarm water. Even the room floor was so cold that you just cannot walk bare foot on it. Overall not so good as it seemed in the pictures. Also I had requested to put gst no. of my firm on invoice, the previous receptionist agreed but the one at the time of checkout just denied and was not at all co-operative. He didnt even give invoice to one of my colleagues who was staying at the same place, saying you can download from booking website. Overall not so good experience""}, {'Review_Rating': '2.0', 'Review_Heading': 'Pathetic Staff”', 'Review_Body': ""The staff was so rude and doesn't know how to treat their customers. The location is also not so good. Really disappointed by the staff. WORST HOTEL EVER STAYED IN. ""}, {'Review_Rating': '2.4', 'Review_Heading': 'Not a very good choice of hotel”', 'Review_Body': 'The hotel was OK type '}], 'price': '2,666', 'img_link': 'https://pix8.agoda.net/hotelImages/26079507/-1/1bc25409f9bc8db576cbe8d36fb56b59.jpg?ce=0&s=1024x768', 'room_size': '26m²', 'amenities': ['Smoking allowed', 'Shower', 'Free Wi-Fi', 'Additional toilet', 'Bathrobes', 'Mirror', 'Towels', 'Free Wi-Fi in all rooms!', 'Telephone', 'TV [flat screen]', 'Air conditioning', 'Daily newspaper', 'Fan', 'Mosquito net', 'Wake-up service', 'Desk', 'High floor', 'Closet', 'Clothes dryer', 'Clothes rack', 'Ironing facilities', 'Exterior corridor', 'Fire extinguisher', 'First aid kit'], 'city': 'Delhi NCR', 'link': 'https://agoda.com/en-gb/foxoso-hotel-delhi-airport/hotel/new-delhi-and-ncr-in.html?finalPriceView=1&isShowMobileAppPrice=false&cid=-999&numberOfBedrooms=&familyMode=false&adults=2&children=0&rooms=1&maxRooms=0&checkIn=2023-03-18&isCalendarCallout=false&childAges=&numberOfGuest=0&missingChildAges=false&travellerType=1&showReviewSubmissionEntry=false&currencyCode=INR&isFreeOccSearch=false&isCityHaveAsq=false&tspTypes=9&los=1&searchrequestid=b7279941-44b9-4c5f-8bf9-6c553d4e58a8'}"
21,"{'Location': 'Village Ullahwas, Urban Complex, Sector 60, Gurugram, Gurgaon, New Delhi and NCR, India, 122011', 'overall_rating': '7.0', 'Name': 'Red Fox Hotel Sector 60 Gurugram', 'reviews': [{'Review_Rating': '2.0', 'Review_Heading': 'Shitty hotel”', 'Review_Body': 'The wall paint was coming out\nThe rooms had a very stale smell\nThe room is really small\nTotally overpriced'}, {'Review_Rating': '10.0', 'Review_Heading': 'Peaceful stay”', 'Review_Body': 'If you are a couple and want to spend some peaceful time, you can choose this stay. We had breakfast here too, the food was good as well'}, {'Review_Rating': '10.0', 'Review_Heading': 'Excellent hotel ”', 'Review_Body': 'I loved my stay, friendly staff and super good rooms . Would recommend!! Wish I could stay more'}, {'Review_Rating': '9.2', 'Review_Heading': 'Decent hotel”', 'Review_Body': 'Good food, clean rooms and accomodating staff'}, {'Review_Rating': '6.0', 'Review_Heading': 'Above average”', 'Review_Body': 'I have noticed hotel using the bathroom towels to clean the toilets as well. I was shocked on how the same towel we are expected to take wash with be used for cleaning floor and other areas. They need to change their SOP'}, {'Review_Rating': '3.6', 'Review_Heading': 'Acceptable”', 'Review_Body': 'Room was very dirty'}, {'Review_Rating': '3.2', 'Review_Heading': 'Worst ”', 'Review_Body': 'The rooms were very small and pathetic . No basic stuff were provided. The breakfast was okish type. 1 out of 5 '}, {'Review_Rating': '4.4', 'Review_Heading': 'Required gst invoice ”', 'Review_Body': 'Dear Sir\nRedfox hotel not given me gst  invoice after demand,  so I request you please send me at urgent basis my company  gst no is 27AABCM2321E1Z1\nThanks & Regards\n\nSanjay Joglekar \nStay at hotel redfox from 11 to 12 , 1 night bill  amounting 4771.75'}, {'Review_Rating': '3.2', 'Review_Heading': 'Not Value for Money ”', 'Review_Body': 'Very small rooms, No staff, mattress was not comfortable '}, {'Review_Rating': '4.4', 'Review_Heading': 'Acceptable”', 'Review_Body': 'Front desk staff didn’t respond to our queries and requests as promised. No room keys were given, toilet seat was broken and no change of room at our request '}, {'Review_Rating': '3.6', 'Review_Heading': 'Acceptable”', 'Review_Body': 'Not up to the mark. The room was not clean and the table was dirty. Did not feel value for money. '}, {'Review_Rating': '2.8', 'Review_Heading': 'Only for Business stay”', 'Review_Body': 'This hotel is overpriced. It does not have enough facilities for recreational activities. Rooms are very simple and staff is untrained. Though they always listen to you but they lack professionalism. The hotel does not have bar , that’s why they couldn’t even give us the wine glasses. Overall experience was satisfactory. You can choose this one only when you’re travelling alone for business purpose for one or two days. Locality is very far from Huda city center. Tarif is overpriced for facilities they provide. '}, {'Review_Rating': '9.2', 'Review_Heading': 'Exceptional”', 'Review_Body': 'It is good for money'}, {'Review_Rating': '5.2', 'Review_Heading': 'Not a great stay”', 'Review_Body': 'The room was very small. '}, {'Review_Rating': '2.0', 'Review_Heading': 'Never ever think of going to Red Fox Hotel”', 'Review_Body': 'This is the worst experience in my life staying in Red fox. Lemon Tree always disappointed by again gave a chance this time. But this was the worst one. Local hotels are much better then this hotel.'}, {'Review_Rating': '9.6', 'Review_Heading': 'Value for money”', 'Review_Body': 'It is at little far located however room is good cleaned staff is good value for money'}, {'Review_Rating': '5.6', 'Review_Heading': 'No good facilities ”', 'Review_Body': 'Lack of service response\nLack in facilities '}, {'Review_Rating': '8.4', 'Review_Heading': 'Good property in Sec 60”', 'Review_Body': 'Its one of the good properties in Gurugram Sec 60. Decent room size and comfortable bed.'}, {'Review_Rating': '7.2', 'Review_Heading': 'Courteous and supportive staff ”', 'Review_Body': ""I felt that the room charges were on higher side measured on account of the facilities provided. The rooms were clean but need improvement. The kettle provided wasn't clean enough to use it. Washroom's cleanliness was satisfactory. We asked for the extra bed and blanket, the blanket provided wasn't satisfactory on the grounds of cleanliness ,  so i had to ask it to be changed. \n\nManager was supportive, the reception staff was super nice as one of the staff assisted  my parents check-in in my absence.  \nOverall the experience was Okay, i was expecting it to be better with respect to the cleanliness. ""}, {'Review_Rating': '6.8', 'Review_Heading': 'Good”', 'Review_Body': 'Okay'}], 'price': '1,918', 'img_link': 'https://pix8.agoda.net/hotelImages/2100017/12480742/dafdc55b8cf1f9d486c94951b153699a.jpeg?ce=0&s=1024x768', 'room_size': '19m²', 'amenities': ['City view', 'Non-smoking', 'Shower', 'Free Wi-Fi', 'Cleaning products', 'Hair dryer', 'Mirror', 'Toiletries', 'Towels', 'DVD/CD player', 'Free Wi-Fi in all rooms!', 'Satellite/cable channels', 'Telephone', 'Air conditioning', 'Blackout curtains', 'Daily newspaper', 'Linens', 'Slippers', 'Coffee/tea maker', 'Complimentary tea', 'Mini bar', 'Refrigerator', 'Desk', 'Laptop workspace', 'Seating area', 'Sofa', 'Wooden/parqueted flooring', 'Closet', 'Clothes rack', 'Dressing room', 'Ironing facilities', 'In-room safe box', 'Locker'], 'city': 'Delhi NCR', 'link': 'https://agoda.com/en-gb/red-fox-hotel-sector-60-gurugram/hotel/new-delhi-and-ncr-in.html?finalPriceView=1&isShowMobileAppPrice=false&cid=-999&numberOfBedrooms=&familyMode=false&adults=2&children=0&rooms=1&maxRooms=0&checkIn=2023-03-18&isCalendarCallout=false&childAges=&numberOfGuest=0&missingChildAges=false&travellerType=1&showReviewSubmissionEntry=false&currencyCode=INR&isFreeOccSearch=false&isCityHaveAsq=false&los=1&searchrequestid=b7279941-44b9-4c5f-8bf9-6c553d4e58a8'}"
22,"{'Location': 'Plot No.4 Sector 13, Dwarka, New Delhi and NCR, India, 110075', 'overall_rating': '7.3', 'Name': 'Radisson Blu Hotel New Delhi Dwarka', 'reviews': [{'Review_Rating': '9.2', 'Review_Heading': 'Reception”', 'Review_Body': 'Reception very low service other all are good'}, {'Review_Rating': '3.6', 'Review_Heading': 'under repair”', 'Review_Body': 'less than a 3 star property'}, {'Review_Rating': '4.4', 'Review_Heading': 'Worst 5 star hotel”', 'Review_Body': 'Just to say you will experience the worst experience here '}, {'Review_Rating': '9.6', 'Review_Heading': 'Nice!! ”', 'Review_Body': 'Was a great experience. Comfortable stay! '}, {'Review_Rating': '8.4', 'Review_Heading': 'Excellent”', 'Review_Body': 'Too small the rooms are,plus lots of noisy guests around the lobby at night just making it appear like any other Oyo hotel,the breakfast was great but there was no feeling of making the guest feel welcomed.. everything was cool and calm from a distance..lack the warmth which even small hotels give in other states like Kerala,Andhra Pradesh etc'}, {'Review_Rating': '2.8', 'Review_Heading': 'Rude Staff, Poor Facilities. Not a 5 Star.”', 'Review_Body': 'I booked this hotel for my aunt & uncle. \nThey had a terrible experience. Their luggage kept lying in the lobby for 1 hour, reception did not respond to the calls. He had to walk up to the lobby and request 2 bell boys to send their luggage. But the both of them were busy on their phones. \nThen he approached, Siddarth, probably the manager. He was equally lazy and ineffective. \nThe TV of the room wasn’t working. They informed the staff. The technician arrived at 11:30 PM and rang their bell to fix the TV.\nIn nutshell it’s just OYO Rooms in a bigger building.  '}, {'Review_Rating': '3.6', 'Review_Heading': 'Worst exp ”', 'Review_Body': 'Got the room late had to wait till 3.30 pm got a room where the light was not working after couple elf follow up some one came to rectify for water we had to request 8 times in the night breakfast time got coffee in broken cup whn asked to redo th cup the intern did not understand was told lunch is 899 plus tax but got charged 1500 for each person and last did not give the bill while checking out what a sad service now I am following to get the bill as I need to submit at office \n\nRadission this way will lose its name '}, {'Review_Rating': '6.0', 'Review_Heading': 'Above average”', 'Review_Body': ""It was worst hotel room service...I ordered baryani it's take more than one hour to send ...I'm surprised after this much time there was no cutlery with it \nI  have called more then 5 times to room service and they take 20 min for it \nThat  time food was cold\n\nWorst stay ""}, {'Review_Rating': '4.0', 'Review_Heading': 'Worst hotel, worst front desk ever seen”', 'Review_Body': ""These is the worst hotel ever I stayed in my life. Should be downgraded to a 3 star hotel.\n1. Front desk don't know, how to bill and whom and what to bill\n2. They kept the crimping tools with them and gave us a receipt of the same. At the time of check out , we forgot the receipt in hotel room and checked out. When we ask then to please give us the tool or let us go to our room for the receipt. They categorically denied it. It's feel like we are thieves and will take from rooms.\n3. Chinese items which is served at dinner is kept in the morning breakfast too.\n4. I have seen an shower where you have to kept pushing the button for water to come out.\n5. Rooms were shoggy and you can see mark of seepage in our room. Mind you, We were staying in business class room. Room no 844, if you have any doubts.\n6. Last but not the least, they took 2 hours to clear our bills. This is when our full payment was done at the time of check in. We have to literally shout at the desk else we would have missed iur flight.\n7. Worst hotel in every sense. ""}, {'Review_Rating': '3.2', 'Review_Heading': 'Acceptable”', 'Review_Body': 'Terrible in room service staff. No one will pick your call for hours'}, {'Review_Rating': '10.0', 'Review_Heading': 'Great property ”', 'Review_Body': ""It's a great property to stay nearby airport ""}, {'Review_Rating': '10.0', 'Review_Heading': 'Hotel with a heart”', 'Review_Body': 'I stayed here with my wife for 3 nights starting 13th Jan. This is an exemplary hotel. Right from reception to the room, we could see people helping us with a smile. The duty manager Mr Aditya is an excellent executive with complete focus on guest happiness. The room given to us was excellent and the food was superb. The cleanliness and the ambience of the hotel was right upto the standard. We are very happy having spent the wuality time there. Cheers.'}, {'Review_Rating': '6.0', 'Review_Heading': 'Huge crowd ”', 'Review_Body': 'Lifts were not working properly. It took around 15 minutes if i anyone wants to go outside the hotel via lift. 2 Lifts were there out of which one was not working. '}, {'Review_Rating': '9.6', 'Review_Heading': 'Exceptional”', 'Review_Body': 'Good'}, {'Review_Rating': '8.8', 'Review_Heading': 'Good hotel with quality food options”', 'Review_Body': 'We stayed for one night in this hotel. Dinner and breakfast was included in price and food was really good. Staff was very friendly. Only negative point is location in case you have to travel to international airport during morning 9 to 11 AM. At that time, there is too much traffic on road and it may take a lot of time (we nearly missed our flight).'}, {'Review_Rating': '9.6', 'Review_Heading': 'Comfortable stay”', 'Review_Body': 'I recommend this property. Very safe, comfortable, quick service and amiable staff. Enjoyed my stay here'}, {'Review_Rating': '8.8', 'Review_Heading': 'Great customer services.”', 'Review_Body': 'Will stay again. Very satisfied'}, {'Review_Rating': '9.2', 'Review_Heading': 'Amazing Property and Food too !!”', 'Review_Body': 'I stayed here for two days because of some official work and I must say all it was really a good experience.Rooms were very good and services specially Housekeeping was amazing.Food options were good in both breakfast and dinner buffet. Thanks '}, {'Review_Rating': '10.0', 'Review_Heading': 'Exceptional”', 'Review_Body': 'Very good ambience and service'}, {'Review_Rating': '10.0', 'Review_Heading': 'Exceptional”', 'Review_Body': 'Rooms need renovation. Housekeeping not picking up calls. F & B services at the coffee shop was excellent.'}], 'price': '7,958', 'img_link': 'https://pix8.agoda.net/hotelImages/9455128/461206245/f8c1a0732591a9b0387048e169525aa1.jpg?ca=24&ce=0&s=1024x768', 'room_size': '32m²', 'amenities': ['City view', 'Non-smoking', 'Shower', 'Free Wi-Fi', 'Accessible toilet', 'Adapted bath', 'Bathrobes', 'Bathroom phone', 'Hair dryer', 'Mirror', 'Scale', 'Toiletries', 'Towels', 'DVD/CD player', 'Free Wi-Fi in all rooms!', 'Reading light', 'Satellite/cable channels', 'Telephone', 'Adapter', 'Air conditioning', 'Alarm clock', 'Blackout curtains', 'Concierge', 'Daily newspaper', 'Heating', 'Linens', 'Private entrance', 'Slippers', 'Soundproofing', 'Umbrella', 'Wake-up service', 'Coffee/tea maker', 'Free bottled water', 'Mini bar', 'Refrigerator', 'Daily housekeeping', 'Desk', 'High chair', 'Interconnecting room(s) available', 'Seating area', 'Sofa', 'Trash cans', 'Closet', 'Clothes rack', 'Ironing facilities', 'Sewing kit', 'Shoeshine kit', 'Trouser press', 'Accessible by elevator', 'In-room safe box', 'Locker', 'Safety/security feature', 'Smoke detector'], 'city': 'Delhi NCR', 'link': 'https://agoda.com/en-gb/radisson-blu-hotel-new-delhi-dwarka/hotel/new-delhi-and-ncr-in.html?finalPriceView=1&isShowMobileAppPrice=false&cid=-999&numberOfBedrooms=&familyMode=false&adults=2&children=0&rooms=1&maxRooms=0&checkIn=2023-03-18&isCalendarCallout=false&childAges=&numberOfGuest=0&missingChildAges=false&travellerType=1&showReviewSubmissionEntry=false&currencyCode=INR&isFreeOccSearch=false&isCityHaveAsq=false&los=1&searchrequestid=b7279941-44b9-4c5f-8bf9-6c553d4e58a8'}"
